Name,Description,Rareness
"Sándwich de pollo","Lleva pechuga, lechuga, tomate y mayonesa. (VID +10)",1
"Refresco","Bebida refrescante con aroma a cola. (VID +5)",1
"Camiseta del Betis","Camiseta oficial del Real Betis Balompié.",1
"Bate de béisbol","El arma idónea en un apocalipsis zombi. (ATQ +2)", 2
"Bolsa de palomitas al microondas","Palomitas de maíz listas en 2 minutos. (VID +5 a cada compi)",2
"Galleta de la abuelita","¡Come! ¡Que estás en los huesos! (Elimina estados alterados negativos)",2
"Coche teledirigido","Enseña una nueva técnica a Mark: «Coche bomba».",3
"Colgante místico","La mejor armadura para Hikaru.",3